{
  "schemaVersion": 1,
  "revision": 1,
  "lessons": [
    {
      "id": "micro-code-objective",
      "version": 1,
      "level": "L0",
      "anchor": "code.objective",
      "domain": "code",
      "title": "Turn a vague idea into a testable specification.",
      "content": "Describe the app’s users, required screens, programming languages, external services, and what must happen when something fails. Include how you would verify the result.",
      "example": "Create a web app with login, an editable dashboard, a PostgreSQL database and automated tests.",
      "prerequisites": [],
      "visibility": "published",
      "approvedBy": "initial editorial specification",
      "reviewedAt": "2026-10-11"
    },
    {
      "id": "micro-music-objective",
      "version": 1,
      "level": "L0",
      "anchor": "music.objective",
      "domain": "music",
      "title": "Describe the sound, not just the genre.",
      "content": "Specify the rhythm, instrumentation, tempo feel, arrangement, and any parts that must stand out. Distinguish a purely instrumental result from one that needs vocals.",
      "example": "I want an actionable, editable music deliverable and a way to review the result.",
      "prerequisites": [],
      "visibility": "published",
      "approvedBy": "initial editorial specification",
      "reviewedAt": "2026-10-11"
    },
    {
      "id": "micro-poetry-objective",
      "version": 1,
      "level": "L0",
      "anchor": "poetry.objective",
      "domain": "poetry",
      "title": "Choose what a poem should make a reader experience.",
      "content": "Define the emotional shift, imagery, voice, stanza structure and whether rhythm, rhyme or free verse matters more than a rigid syllable count.",
      "example": "I want an actionable, editable poetry deliverable and a way to review the result.",
      "prerequisites": [],
      "visibility": "published",
      "approvedBy": "initial editorial specification",
      "reviewedAt": "2026-10-11"
    },
    {
      "id": "micro-persuasivewriting-objective",
      "version": 1,
      "level": "L0",
      "anchor": "persuasive-writing.objective",
      "domain": "persuasive-writing",
      "title": "Begin with the audience and a concrete desired action.",
      "content": "Identify who you are trying to persuade, what they currently believe, what evidence they trust and one strong objection your argument must answer.",
      "example": "I want an actionable, editable persuasive-writing deliverable and a way to review the result.",
      "prerequisites": [],
      "visibility": "published",
      "approvedBy": "initial editorial specification",
      "reviewedAt": "2026-10-11"
    },
    {
      "id": "micro-research-objective",
      "version": 1,
      "level": "L0",
      "anchor": "research.objective",
      "domain": "research",
      "title": "Frame a falsifiable research question.",
      "content": "Specify what counts as a credible source, geographic and date limits, potential counterevidence and the exact evidence required to support each claim.",
      "example": "I want an actionable, editable research deliverable and a way to review the result.",
      "prerequisites": [],
      "visibility": "published",
      "approvedBy": "initial editorial specification",
      "reviewedAt": "2026-10-11"
    },
    {
      "id": "micro-legislation-objective",
      "version": 1,
      "level": "L0",
      "anchor": "legislation.objective",
      "domain": "legislation",
      "title": "State the policy objective before drafting statutory language.",
      "content": "Choose the legal jurisdiction, existing statutes to amend, defined terms, enforcement mechanism, implementation timing and expected stakeholders.",
      "example": "I want an actionable, editable legislation deliverable and a way to review the result.",
      "prerequisites": [],
      "visibility": "published",
      "approvedBy": "initial editorial specification",
      "reviewedAt": "2026-10-11"
    },
    {
      "id": "micro-image-objective",
      "version": 1,
      "level": "L0",
      "anchor": "image.objective",
      "domain": "image",
      "title": "Describe composition with measurable details.",
      "content": "Specify subject, framing, camera or perspective, light, palette, references and the region to edit or preserve. Keep any embedded text short and explicit.",
      "example": "I want an actionable, editable image deliverable and a way to review the result.",
      "prerequisites": [],
      "visibility": "published",
      "approvedBy": "initial editorial specification",
      "reviewedAt": "2026-10-11"
    },
    {
      "id": "micro-video-objective",
      "version": 1,
      "level": "L0",
      "anchor": "video.objective",
      "domain": "video",
      "title": "Plan deliverables before generating shots.",
      "content": "Describe duration, aspect ratio, script, shot count, subject consistency, continuity references, soundtrack and final export format.",
      "example": "I want an actionable, editable video deliverable and a way to review the result.",
      "prerequisites": [],
      "visibility": "published",
      "approvedBy": "initial editorial specification",
      "reviewedAt": "2026-10-11"
    },
    {
      "id": "micro-voice-objective",
      "version": 1,
      "level": "L0",
      "anchor": "voice.objective",
      "domain": "voice",
      "title": "Write for listening rather than only reading.",
      "content": "Specify audience, delivery pace, language, pronunciation, transcript or caption needs and rights to use any distinctive voice.",
      "example": "I want an actionable, editable voice deliverable and a way to review the result.",
      "prerequisites": [],
      "visibility": "published",
      "approvedBy": "initial editorial specification",
      "reviewedAt": "2026-10-11"
    },
    {
      "id": "micro-data-objective",
      "version": 1,
      "level": "L0",
      "anchor": "data.objective",
      "domain": "data",
      "title": "Define the question and data quality rules first.",
      "content": "Describe data sources, units, missing values, outlier treatment, transformations, chart conventions and how to reproduce the analysis.",
      "example": "I want an actionable, editable data deliverable and a way to review the result.",
      "prerequisites": [],
      "visibility": "published",
      "approvedBy": "initial editorial specification",
      "reviewedAt": "2026-10-11"
    },
    {
      "id": "micro-workflow-objective",
      "version": 1,
      "level": "L0",
      "anchor": "workflow.objective",
      "domain": "workflow",
      "title": "Start with inputs, decisions, approvals and final outputs.",
      "content": "Identify each automated step, its prerequisites, cost limit, failure handling and exactly which consequential actions require human approval.",
      "example": "I want an actionable, editable workflow deliverable and a way to review the result.",
      "prerequisites": [],
      "visibility": "published",
      "approvedBy": "initial editorial specification",
      "reviewedAt": "2026-10-11"
    }
  ],
  "courses": []
}
